{
  "$schema": "https://json-schema.org/draft/2020-12/schema",
  "$id": "profile.schema.json",
  "title": "Profile Registry Entry",
  "type": "object",
  "additionalProperties": false,
  "required": [
    "name",
    "description",
    "version",
    "recommendedWorkflow",
    "recommendedAgents",
    "recommendedCapabilities",
    "recommendedLanguageProfiles",
    "recommendedRuntimeProfiles"
  ],
  "properties": {
    "name": {
      "type": "string",
      "minLength": 1
    },
    "description": {
      "type": "string",
      "minLength": 1
    },
    "version": {
      "type": "string",
      "pattern": "^(0|[1-9][0-9]*)\\.(0|[1-9][0-9]*)\\.(0|[1-9][0-9]*)$"
    },
    "recommendedAgents": {
      "type": "array",
      "minItems": 1,
      "uniqueItems": true,
      "items": {
        "type": "string",
        "minLength": 1
      }
    },
    "recommendedCapabilities": {
      "type": "array",
      "minItems": 1,
      "uniqueItems": true,
      "items": {
        "type": "string",
        "minLength": 1
      }
    },
    "recommendedLanguageProfiles": {
      "type": "array",
      "minItems": 1,
      "uniqueItems": true,
      "items": {
        "type": "string",
        "minLength": 1
      }
    },
    "recommendedRuntimeProfiles": {
      "type": "array",
      "minItems": 1,
      "uniqueItems": true,
      "items": {
        "type": "string",
        "minLength": 1
      }
    },
    "recommendedWorkflow": {
      "type": "string",
      "minLength": 1
    }
  }
}
