{
  "name": "lean-delivery",
  "version": "0.2.0",
  "description": "Workflow profile for focused software changes that need deterministic implementation, test, and review gates without a separate architecture or QA phase.",
  "recommendedWorkflow": "lean-delivery",
  "recommendedAgents": [
    "Orchestrator",
    "Requirements",
    "Implementer",
    "TestRunner",
    "CodeReviewer"
  ],
  "recommendedCapabilities": [
    "workflow.route",
    "workflow.validate-state",
    "workflow.handoff",
    "requirements.elicit",
    "requirements.define-acceptance-criteria",
    "implementation.code",
    "implementation.refactor",
    "implementation.update-tests",
    "test.run",
    "test.report",
    "test.diagnose-failure",
    "review.clean-code",
    "review.tests",
    "review.security"
  ],
  "recommendedLanguageProfiles": [
    "language-agnostic"
  ],
  "recommendedRuntimeProfiles": [
    "local",
    "ci"
  ]
}
